<!ELEMENT vm (binaryOptions, numericOptions?, booleanConstraints?, nonBooleanConstraints?, mixedConstraints?)>
<!ATTLIST vm name CDATA #REQUIRED root CDATA #IMPLIED commit CDATA #IMPLIED>
<!ELEMENT binaryOptions (configurationOption*)>
<!ELEMENT numericOptions (configurationOption*)>
<!ELEMENT booleanConstraints (constraint*)>
<!ELEMENT nonBooleanConstraints (constraint*)>
<!ELEMENT mixedConstraints (constraint*)>
<!ELEMENT configurationOption (name, outputString?, (prefix | preFix)?, (postfix | postFix)?, parent?, children?, impliedOptions?, excludedOptions?, optional?, ((minValue, maxValue) | values)?, stepFunction?, defaultValue?, locations?)>
<!ELEMENT constraint (#PCDATA)>
<!ATTLIST constraint req CDATA #IMPLIED exprKind CDATA #IMPLIED>
<!ELEMENT name (#PCDATA)>
<!ELEMENT outputString (#PCDATA)>
<!ELEMENT prefix (#PCDATA)>
<!ELEMENT preFix (#PCDATA)>
<!ELEMENT postfix (#PCDATA)>
<!ELEMENT postFix (#PCDATA)>
<!ELEMENT parent (#PCDATA)>
<!ELEMENT children (options*)>
<!ELEMENT impliedOptions (options*)>
<!ELEMENT excludedOptions (options*)>
<!ELEMENT defaultValue (#PCDATA)>
<!ELEMENT options (#PCDATA)>
<!ELEMENT optional (#PCDATA)>
<!ELEMENT minValue (#PCDATA)>
<!ELEMENT maxValue (#PCDATA)>
<!ELEMENT values (#PCDATA)>
<!ELEMENT stepFunction (#PCDATA)>
<!ELEMENT locations (sourceRange*)>
<!ELEMENT sourceRange (revisionRange?, path, start, end, memberOffset?)>
<!ATTLIST sourceRange category (necessary|inessential) "necessary">
<!ELEMENT revisionRange (introduced, removed?)>
<!ELEMENT introduced (#PCDATA)>
<!ELEMENT removed (#PCDATA)>
<!ELEMENT path (#PCDATA)>
<!ELEMENT start (line, column)>
<!ELEMENT end (line, column)>
<!ELEMENT line (#PCDATA)>
<!ELEMENT column (#PCDATA)>
<!ELEMENT memberOffset (#PCDATA)>
