<?xml version="1.0" encoding="UTF-8"?>
<!DOCTYPE vm SYSTEM "vm.dtd">
<vm name="ABC" root="test">
  <binaryOptions>
  </binaryOptions>
  <numericOptions>
    <configurationOption>
      <name>A</name>
      <parent>root</parent>
      <optional>True</optional>
      <minValue>0</minValue>
      <maxValue>100</maxValue>
      <stepFunction>x + 42</stepFunction>
    </configurationOption>
  </numericOptions>
</vm>
