<?xml version="1.0" encoding="UTF-8"?>
<!DOCTYPE vm SYSTEM "vm.dtd">
<vm name="Children" root="test">
  <binaryOptions>
    <configurationOption>
      <name>CB</name>
      <parent>C</parent>
      <optional>True</optional>
    </configurationOption>
    <configurationOption>
      <name>A</name>
      <parent>root</parent>
      <optional>True</optional>
    </configurationOption>
    <configurationOption>
      <name>CA</name>
      <parent>C</parent>
      <optional>True</optional>
    </configurationOption>
    <configurationOption>
      <name>root</name>
      <children>
        <options>A</options>
        <options>B</options>
        <options>C</options>
      </children>
      <optional>False</optional>
    </configurationOption>
    <configurationOption>
      <name>CC</name>
      <parent>C</parent>
      <optional>True</optional>
    </configurationOption>
    <configurationOption>
      <name>B</name>
      <parent>root</parent>
      <optional>True</optional>
    </configurationOption>
  </binaryOptions>
  <numericOptions/>
  <booleanConstraints/>
</vm>
