<?xml version="1.0" encoding="UTF-8"?>
<!DOCTYPE vm SYSTEM "vm.dtd">
<vm name="Children" root="test">
  <binaryOptions>
    <configurationOption>
      <name>root</name>
      <children>
        <options>A</options>
        <options>B</options>
        <options>C</options>
      </children>
      <optional>False</optional>
    </configurationOption>
    <configurationOption>
      <name>A</name>
      <parent>root</parent>
      <optional>True</optional>
      <locations>
        <sourceRange>
          <path>path/test.c</path>
          <start>
            <line>24</line>
            <column>1337</column>
          </start>
          <end>
            <line>42</line>
            <column>7331</column>
          </end>
        </sourceRange>
        <sourceRange>
          <path>path/test.c</path>
          <start>
            <line>24</line>
            <column>1337</column>
          </start>
          <end>
            <line>42</line>
            <column>7331</column>
          </end>
        </sourceRange>
      </locations>
    </configurationOption>
    <configurationOption>
      <name>B</name>
      <parent>root</parent>
      <optional>True</optional>
    </configurationOption>
    <configurationOption>
      <name>C</name>
      <parent>root</parent>
      <children>
        <options>CA</options>
        <options>CB</options>
        <options>CC</options>
      </children>
      <optional>True</optional>
    </configurationOption>
    <configurationOption>
      <name>CA</name>
      <parent>C</parent>
      <optional>True</optional>
    </configurationOption>
    <configurationOption>
      <name>CB</name>
      <parent>C</parent>
      <optional>True</optional>
    </configurationOption>
    <configurationOption>
      <name>CC</name>
      <parent>C</parent>
      <optional>True</optional>
    </configurationOption>
  </binaryOptions>
  <numericOptions/>
  <booleanConstraints/>
</vm>
